{
  "generated_at": "2026-03-06T08:25:10.397283+00:00",
  "input_summary": {
    "jd_documents": 3,
    "avg_jd_term_count": 32.0,
    "cv_sections": [
      "summary",
      "experience",
      "skills",
      "education"
    ],
    "config_weighted_keywords": 7
  },
  "scores": {
    "coverage_score": 47.8,
    "confidence": 0.1652
  },
  "weighted_keywords": [
    {
      "keyword": "monetization",
      "normalized_keyword": "monetization",
      "jd_doc_freq": 1,
      "jd_term_freq": 1,
      "tfidf_weight": 0.020903,
      "role_prior": 5.0,
      "final_weight": 0.038671,
      "cv_hits_total": 1,
      "cv_section_hits": {
        "summary": 0,
        "experience": 1,
        "skills": 0,
        "education": 0
      },
      "cv_weighted_hits": 2.8,
      "evidence_hits": 0,
      "evidence_multiplier": 1.0,
      "coverage": 1.0,
      "confidence": 0.1652,
      "gap_severity": "none"
    },
    {
      "keyword": "looker",
      "normalized_keyword": "looker",
      "jd_doc_freq": 1,
      "jd_term_freq": 1,
      "tfidf_weight": 0.020903,
      "role_prior": 4.0,
      "final_weight": 0.03658,
      "cv_hits_total": 1,
      "cv_section_hits": {
        "summary": 0,
        "experience": 0,
        "skills": 1,
        "education": 0
      },
      "cv_weighted_hits": 1.9,
      "evidence_hits": 0,
      "evidence_multiplier": 1.0,
      "coverage": 0.95,
      "confidence": 0.1652,
      "gap_severity": "none"
    },
    {
      "keyword": "live",
      "normalized_keyword": "live",
      "jd_doc_freq": 2,
      "jd_term_freq": 2,
      "tfidf_weight": 0.02493,
      "role_prior": 0.0,
      "final_weight": 0.034653,
      "cv_hits_total": 2,
      "cv_section_hits": {
        "summary": 1,
        "experience": 1,
        "skills": 0,
        "education": 0
      },
      "cv_weighted_hits": 4.644,
      "evidence_hits": 1,
      "evidence_multiplier": 1.08,
      "coverage": 1.0,
      "confidence": 0.1652,
      "gap_severity": "none"
    },
    {
      "keyword": "live ops",
      "normalized_keyword": "live ops",
      "jd_doc_freq": 1,
      "jd_term_freq": 1,
      "tfidf_weight": 0.015677,
      "role_prior": 7.0,
      "final_weight": 0.032766,
      "cv_hits_total": 1,
      "cv_section_hits": {
        "summary": 1,
        "experience": 0,
        "skills": 0,
        "education": 0
      },
      "cv_weighted_hits": 1.5,
      "evidence_hits": 0,
      "evidence_multiplier": 1.0,
      "coverage": 0.75,
      "confidence": 0.1652,
      "gap_severity": "low"
    },
    {
      "keyword": "analytic",
      "normalized_keyword": "analytic",
      "jd_doc_freq": 1,
      "jd_term_freq": 1,
      "tfidf_weight": 0.015677,
      "role_prior": 6.0,
      "final_weight": 0.031198,
      "cv_hits_total": 2,
      "cv_section_hits": {
        "summary": 1,
        "experience": 0,
        "skills": 1,
        "education": 0
      },
      "cv_weighted_hits": 3.4,
      "evidence_hits": 0,
      "evidence_multiplier": 1.0,
      "coverage": 1.0,
      "confidence": 0.1652,
      "gap_severity": "none"
    },
    {
      "keyword": "sql",
      "normalized_keyword": "sql",
      "jd_doc_freq": 1,
      "jd_term_freq": 1,
      "tfidf_weight": 0.015677,
      "role_prior": 5.0,
      "final_weight": 0.02963,
      "cv_hits_total": 2,
      "cv_section_hits": {
        "summary": 0,
        "experience": 1,
        "skills": 1,
        "education": 0
      },
      "cv_weighted_hits": 5.076,
      "evidence_hits": 1,
      "evidence_multiplier": 1.08,
      "coverage": 1.0,
      "confidence": 0.1652,
      "gap_severity": "none"
    },
    {
      "keyword": "telemetry",
      "normalized_keyword": "telemetry",
      "jd_doc_freq": 1,
      "jd_term_freq": 1,
      "tfidf_weight": 0.015677,
      "role_prior": 5.0,
      "final_weight": 0.02963,
      "cv_hits_total": 1,
      "cv_section_hits": {
        "summary": 0,
        "experience": 0,
        "skills": 1,
        "education": 0
      },
      "cv_weighted_hits": 1.9,
      "evidence_hits": 0,
      "evidence_multiplier": 1.0,
      "coverage": 0.95,
      "confidence": 0.1652,
      "gap_severity": "none"
    },
    {
      "keyword": "analyze",
      "normalized_keyword": "analyze",
      "jd_doc_freq": 1,
      "jd_term_freq": 1,
      "tfidf_weight": 0.020903,
      "role_prior": 0.0,
      "final_weight": 0.028219,
      "cv_hits_total": 0,
      "cv_section_hits": {
        "summary": 0,
        "experience": 0,
        "skills": 0,
        "education": 0
      },
      "cv_weighted_hits": 0.0,
      "evidence_hits": 0,
      "evidence_multiplier": 1.0,
      "coverage": 0.0,
      "confidence": 0.1652,
      "gap_severity": "critical"
    },
    {
      "keyword": "build",
      "normalized_keyword": "build",
      "jd_doc_freq": 1,
      "jd_term_freq": 1,
      "tfidf_weight": 0.020903,
      "role_prior": 0.0,
      "final_weight": 0.028219,
      "cv_hits_total": 0,
      "cv_section_hits": {
        "summary": 0,
        "experience": 0,
        "skills": 0,
        "education": 0
      },
      "cv_weighted_hits": 0.0,
      "evidence_hits": 0,
      "evidence_multiplier": 1.0,
      "coverage": 0.0,
      "confidence": 0.1652,
      "gap_severity": "critical"
    },
    {
      "keyword": "dashboard",
      "normalized_keyword": "dashboard",
      "jd_doc_freq": 1,
      "jd_term_freq": 1,
      "tfidf_weight": 0.020903,
      "role_prior": 0.0,
      "final_weight": 0.028219,
      "cv_hits_total": 1,
      "cv_section_hits": {
        "summary": 0,
        "experience": 1,
        "skills": 0,
        "education": 0
      },
      "cv_weighted_hits": 3.024,
      "evidence_hits": 1,
      "evidence_multiplier": 1.08,
      "coverage": 1.0,
      "confidence": 0.1652,
      "gap_severity": "none"
    },
    {
      "keyword": "experiment",
      "normalized_keyword": "experiment",
      "jd_doc_freq": 1,
      "jd_term_freq": 1,
      "tfidf_weight": 0.020903,
      "role_prior": 0.0,
      "final_weight": 0.028219,
      "cv_hits_total": 1,
      "cv_section_hits": {
        "summary": 0,
        "experience": 1,
        "skills": 0,
        "education": 0
      },
      "cv_weighted_hits": 2.8,
      "evidence_hits": 0,
      "evidence_multiplier": 1.0,
      "coverage": 1.0,
      "confidence": 0.1652,
      "gap_severity": "none"
    },
    {
      "keyword": "partner",
      "normalized_keyword": "partner",
      "jd_doc_freq": 1,
      "jd_term_freq": 1,
      "tfidf_weight": 0.020903,
      "role_prior": 0.0,
      "final_weight": 0.028219,
      "cv_hits_total": 0,
      "cv_section_hits": {
        "summary": 0,
        "experience": 0,
        "skills": 0,
        "education": 0
      },
      "cv_weighted_hits": 0.0,
      "evidence_hits": 0,
      "evidence_multiplier": 1.0,
      "coverage": 0.0,
      "confidence": 0.1652,
      "gap_severity": "critical"
    },
    {
      "keyword": "performance",
      "normalized_keyword": "performance",
      "jd_doc_freq": 1,
      "jd_term_freq": 1,
      "tfidf_weight": 0.020903,
      "role_prior": 0.0,
      "final_weight": 0.028219,
      "cv_hits_total": 0,
      "cv_section_hits": {
        "summary": 0,
        "experience": 0,
        "skills": 0,
        "education": 0
      },
      "cv_weighted_hits": 0.0,
      "evidence_hits": 0,
      "evidence_multiplier": 1.0,
      "coverage": 0.0,
      "confidence": 0.1652,
      "gap_severity": "critical"
    },
    {
      "keyword": "producer",
      "normalized_keyword": "producer",
      "jd_doc_freq": 1,
      "jd_term_freq": 1,
      "tfidf_weight": 0.020903,
      "role_prior": 0.0,
      "final_weight": 0.028219,
      "cv_hits_total": 1,
      "cv_section_hits": {
        "summary": 1,
        "experience": 0,
        "skills": 0,
        "education": 0
      },
      "cv_weighted_hits": 1.5,
      "evidence_hits": 0,
      "evidence_multiplier": 1.0,
      "coverage": 0.75,
      "confidence": 0.1652,
      "gap_severity": "low"
    },
    {
      "keyword": "product",
      "normalized_keyword": "product",
      "jd_doc_freq": 1,
      "jd_term_freq": 1,
      "tfidf_weight": 0.020903,
      "role_prior": 0.0,
      "final_weight": 0.028219,
      "cv_hits_total": 1,
      "cv_section_hits": {
        "summary": 0,
        "experience": 0,
        "skills": 1,
        "education": 0
      },
      "cv_weighted_hits": 1.9,
      "evidence_hits": 0,
      "evidence_multiplier": 1.0,
      "coverage": 0.95,
      "confidence": 0.1652,
      "gap_severity": "none"
    },
    {
      "keyword": "communicate",
      "normalized_keyword": "communicate",
      "jd_doc_freq": 1,
      "jd_term_freq": 1,
      "tfidf_weight": 0.017102,
      "role_prior": 0.0,
      "final_weight": 0.022404,
      "cv_hits_total": 0,
      "cv_section_hits": {
        "summary": 0,
        "experience": 0,
        "skills": 0,
        "education": 0
      },
      "cv_weighted_hits": 0.0,
      "evidence_hits": 0,
      "evidence_multiplier": 1.0,
      "coverage": 0.0,
      "confidence": 0.1652,
      "gap_severity": "high"
    },
    {
      "keyword": "drive",
      "normalized_keyword": "drive",
      "jd_doc_freq": 1,
      "jd_term_freq": 1,
      "tfidf_weight": 0.017102,
      "role_prior": 0.0,
      "final_weight": 0.022404,
      "cv_hits_total": 0,
      "cv_section_hits": {
        "summary": 0,
        "experience": 0,
        "skills": 0,
        "education": 0
      },
      "cv_weighted_hits": 0.0,
      "evidence_hits": 0,
      "evidence_multiplier": 1.0,
      "coverage": 0.0,
      "confidence": 0.1652,
      "gap_severity": "high"
    },
    {
      "keyword": "event",
      "normalized_keyword": "event",
      "jd_doc_freq": 1,
      "jd_term_freq": 1,
      "tfidf_weight": 0.017102,
      "role_prior": 0.0,
      "final_weight": 0.022404,
      "cv_hits_total": 0,
      "cv_section_hits": {
        "summary": 0,
        "experience": 0,
        "skills": 0,
        "education": 0
      },